{"$schema":"https://json-schema.org/draft/2020-12/schema","type":"object","required":["coord","rle","entities","landmarks"],"properties":{"coord":{"type":"array","minItems":2,"maxItems":2,"items":{"type":"integer","minimum":0}},"rle":{"type":"array","minItems":36,"maxItems":36,"items":{"type":"array","minItems":1,"items":{"type":"array","minItems":2,"maxItems":2,"prefixItems":[{"type":"string","enum":[".","#","W","="]},{"type":"integer","minimum":1,"maximum":64}]}}},"entities":{"type":"array","items":{"type":"object","required":["uid","type","region","position"]}},"landmarks":{"type":"array","items":{"type":"object","required":["region","piece","position"]}}}}
