{"coord":[4,4],"rle":[[[".",64]],[[".",64]],[[".",16],["=",4],[".",44]],[["=",4],[".",5],["=",4],[".",13],["=",4],[".",20],["=",3],[".",11]],[[".",35],["=",4],[".",5],["=",4],[".",13],["=",3]],[[".",64]],[[".",28],["=",4],[".",20],["=",4],[".",8]],[[".",2],["=",4],[".",6],["=",3],[".",4],["=",4],[".",9],["=",3],[".",5],["=",5],[".",11],["=",3],[".",5]],[[".",64]],[[".",64]],[[".",51],["=",3],[".",2],["=",4],[".",4]],[["=",3],[".",7],["=",3],[".",4],["=",3],[".",7],["=",4],[".",1],["=",4],[".",5],["=",4],[".",19]],[[".",64]],[[".",64]],[[".",12],["=",4],[".",3],["=",10],[".",35]],[[".",5],["=",3],[".",26],["=",4],[".",6],["=",3],[".",1],["=",4],[".",7],["=",4],[".",1]],[[".",64]],[[".",64]],[[".",35],["=",3],[".",6],["=",3],[".",17]],[[".",1],["=",4],[".",3],["=",3],[".",16],["=",4],[".",33]],[[".",19],["=",4],[".",30],["=",3],[".",4],["=",4]],[[".",64]],[[".",24],["=",5],[".",35]],[[".",4],["=",3],[".",3],["=",9],[".",13],["=",4],[".",5],["=",4],[".",3],["=",3],[".",5],["=",5],[".",3]],[[".",64]],[[".",64]],[[".",3],["=",3],[".",22],["=",3],[".",33]],[[".",11],["=",4],[".",1],["=",4],[".",12],["=",3],[".",13],["=",3],[".",6],["=",3],[".",4]],[[".",45],["=",3],[".",16]],[[".",64]],[[".",8],["=",5],[".",46],["=",5]],[["=",4],[".",14],["=",4],[".",3],["=",4],[".",5],["=",9],[".",10],["=",3],[".",8]],[[".",64]],[[".",64]],[[".",45],["=",3],[".",16]],[[".",2],["=",3],[".",12],["=",3],[".",4],["=",3],[".",24],["=",4],[".",9]]],"entities":[{"uid":"enemy_marsh_8","id":"cedar_demon","type":"enemy","region":"marsh","position":[9152,4960],"elite":false,"patrol":96},{"uid":"life_marsh_2","type":"life","region":"marsh","position":[9664,4736]},{"uid":"crystal_marsh_3","type":"crystal","region":"marsh","position":[9568,5344]}],"landmarks":[{"region":"marsh","piece":6,"position":[9088,5216]}]}
