{"coord":[7,0],"rle":[[[".",64]],[[".",64]],[[".",3],["=",3],[".",14],["=",3],[".",25],["=",4],[".",12]],[[".",26],["=",4],[".",2],["=",4],[".",5],["=",3],[".",20]],[[".",13],["=",3],[".",41],["=",3],[".",4]],[[".",64]],[[".",28],["=",4],[".",11],["=",5],[".",16]],[["=",4],[".",4],["=",3],[".",6],["=",4],[".",13],["=",4],[".",13],["=",4],[".",5],["=",4]],[[".",64]],[[".",64]],[[".",29],["=",3],[".",11],["=",3],[".",18]],[["=",3],[".",8],["=",4],[".",3],["=",3],[".",12],["=",3],[".",13],["=",4],[".",11]],[[".",59],["=",4],[".",1]],[[".",64]],[[".",8],["=",5],[".",7],["=",4],[".",11],["=",5],[".",24]],[[".",5],["=",3],[".",16],["=",6],[".",10],["=",4],[".",8],["=",3],[".",1],["=",3],[".",5]],[[".",64]],[[".",64]],[[".",5],["=",7],[".",48],["=",3],[".",1]],[[".",16],["=",4],[".",5],["=",4],[".",13],["=",4],[".",18]],[[".",36],["=",4],[".",13],["=",3],[".",8]],[[".",64]],[[".",44],["=",4],[".",16]],[["=",6],[".",5],["=",4],[".",3],["=",4],[".",6],["=",3],[".",1],["=",5],[".",11],["=",3],[".",6],["=",4],[".",3]],[[".",32],["W",1],[".",31]],[[".",32],["W",1],[".",31]],[[".",13],["=",3],[".",3],["=",3],[".",10],["W",1],[".",31]],[[".",2],["=",3],[".",19],["=",4],[".",4],["W",1],["=",2],[".",1],["=",7],[".",21]],[[".",32],["W",1],[".",16],["=",3],[".",8],["=",4]],[[".",32],["W",1],[".",31]],[[".",4],["=",4],[".",24],["W",1],[".",31]],[[".",8],["=",6],[".",2],["=",4],[".",6],["=",4],[".",2],["W",1],["=",4],[".",1],["=",2],[".",5],["=",3],[".",4],["=",9],[".",3]],[[".",32],["W",1],[".",31]],[[".",32],["W",1],[".",31]],[[".",24],["=",4],[".",4],["W",1],[".",31]],[[".",3],["=",4],[".",3],["=",4],[".",4],["=",3],[".",11],["W",1],["=",2],[".",1],["=",4],[".",16],["=",4],[".",4]]],"entities":[{"uid":"enemy_mine_10","id":"cedar_colossus","type":"enemy","region":"mine","position":[15520,1120],"elite":false,"patrol":96}],"landmarks":[{"region":"mine","piece":1,"position":[14464,1120]}]}
