{"coord":[2,0],"rle":[[[".",24],["W",1],[".",39]],[[".",24],["W",1],[".",39]],[[".",24],["W",1],[".",36],["=",3]],[["=",3],[".",15],["=",3],[".",3],["W",1],["=",2],[".",1],["=",4],[".",1],["=",4],[".",3],["=",3],[".",6],["=",3],[".",12]],[[".",13],["=",3],[".",8],["W",1],[".",39]],[[".",24],["W",1],[".",39]],[[".",20],["=",4],["W",1],[".",26],["=",5],[".",8]],[[".",5],["=",6],[".",13],["W",1],["=",4],[".",1],["=",2],[".",4],["=",3],[".",3],["=",6],[".",8],["=",6],[".",2]],[[".",24],["W",1],[".",39]],[[".",24],["W",1],[".",39]],[["=",4],[".",9],["=",3],[".",8],["W",1],[".",39]],[[".",16],["=",3],[".",5],["W",1],["=",2],[".",1],["=",4],[".",8],["=",4],[".",6],["=",3],[".",4],["=",4],[".",3]],[[".",24],["W",1],[".",8],["=",3],[".",28]],[[".",24],["W",1],[".",39]],[[".",24],["W",1],[".",27],["=",4],[".",8]],[[".",3],["=",4],[".",1],["=",6],[".",4],["=",6],["W",1],["=",4],[".",1],["=",2],[".",4],["=",4],[".",2],["=",4],[".",14],["=",3],[".",1]],[[".",8],["#",16],["W",1],[".",7],["#",32]],[[".",24],["W",1],[".",39]],[[".",24],["W",1],[".",39]],[[".",1],["=",3],[".",8],["=",2],[".",6],["=",2],[".",2],["W",1],["=",2],[".",1],["=",4],[".",4],["=",2],[".",6],["=",2],[".",6],["=",2],[".",6],["=",2],[".",2]],[[".",24],["W",1],[".",39]],[[".",24],["W",1],[".",39]],[[".",3],["=",5],[".",16],["W",1],[".",39]],[[".",8],["=",2],[".",1],["=",7],[".",1],["=",5],["W",1],["=",4],[".",1],["=",4],[".",1],["=",7],[".",1],["=",7],[".",1],["=",7],[".",1],["=",5]],[[".",64]],[[".",64]],[[".",26],["=",6],[".",8],["=",4],[".",17],["=",3]],[[".",2],["=",4],[".",10],["=",4],[".",30],["=",3],[".",11]],[[".",11],["=",4],[".",21],["=",4],[".",24]],[[".",64]],[[".",4],["=",4],[".",44],["=",4],[".",8]],[[".",8],["=",3],[".",7],["=",4],[".",2],["=",4],[".",1],["=",8],[".",6],["=",4],[".",9],["=",6],[".",2]],[[".",24],["W",1],[".",39]],[[".",24],["W",1],[".",39]],[[".",24],["W",1],[".",18],["=",3],[".",7],["=",3],[".",8]],[[".",2],["=",3],[".",12],["=",4],[".",3],["W",1],["=",2],[".",1],["=",4],[".",3],["=",4],[".",25]]],"entities":[{"uid":"enemy_forest_0","id":"cedar_sentinel","type":"enemy","region":"forest","position":[4736,736],"elite":false,"patrol":96},{"uid":"enemy_forest_1","id":"cedar_archer","type":"enemy","region":"forest","position":[5632,736],"elite":false,"patrol":96},{"uid":"altar_double_jump","id":"double_jump","type":"altar","region":"forest","position":[4928,1120]}],"landmarks":[{"region":"forest","piece":0,"position":[4256,864]}]}
