{"coord":[6,0],"rle":[[[".",32],["W",1],[".",31]],[[".",32],["W",1],[".",31]],[[".",32],["W",1],[".",28],["=",3]],[[".",1],["=",4],[".",5],["=",3],[".",3],["=",3],[".",13],["W",1],["=",2],[".",1],["=",4],[".",3],["=",4],[".",1],["=",3],[".",13]],[[".",28],["=",4],["W",1],[".",31]],[[".",32],["W",1],[".",31]],[[".",12],["=",4],[".",16],["W",1],[".",7],["=",5],[".",19]],[[".",4],["=",3],[".",14],["=",8],[".",3],["W",1],["=",4],[".",1],["=",2],[".",10],["=",12],[".",2]],[[".",32],["W",1],[".",31]],[[".",32],["W",1],[".",31]],[[".",28],["=",3],[".",1],["W",1],[".",7],["=",4],[".",20]],[[".",2],["=",4],[".",2],["=",4],[".",20],["W",1],["=",2],[".",1],["=",4],[".",24]],[[".",20],["=",4],[".",8],["W",1],[".",20],["=",3],[".",1],["=",3],[".",4]],[[".",32],["W",1],[".",31]],[[".",4],["=",4],[".",24],["W",1],[".",31]],[[".",10],["=",4],[".",2],["=",5],[".",4],["=",4],[".",3],["W",1],["=",4],[".",1],["=",2],[".",3],["=",4],[".",1],["=",3],[".",9],["=",4]],[[".",32],["W",1],[".",31]],[[".",32],["W",1],[".",31]],[[".",32],["W",1],[".",31]],[[".",18],["=",3],[".",3],["=",3],[".",5],["W",1],["=",2],[".",1],["=",4],[".",1],["=",3],[".",7],["=",4],[".",1],["=",3],[".",5]],[[".",1],["=",3],[".",7],["=",4],[".",17],["W",1],[".",31]],[[".",32],["W",1],[".",31]],[[".",20],["=",4],[".",8],["W",1],[".",10],["=",10],[".",11]],[[".",4],["=",7],[".",18],["=",3],["W",1],["=",4],[".",1],["=",2],[".",18],["=",6]],[[".",8],["#",24],["W",1],[".",7],["#",24]],[[".",32],["W",1],[".",31]],[[".",32],["W",1],[".",31]],[["=",3],[".",9],["=",2],[".",6],["=",2],[".",6],["=",2],[".",2],["W",1],["=",2],[".",1],["=",4],[".",4],["=",2],[".",6],["=",2],[".",6],["=",2],[".",2]],[[".",32],["W",1],[".",31]],[[".",32],["W",1],[".",31]],[[".",32],["W",1],[".",31]],[[".",2],["=",8],[".",1],["=",7],[".",1],["=",7],[".",1],["=",5],["W",1],["=",4],[".",1],["=",4],[".",1],["=",7],[".",1],["=",7],[".",1],["=",5]],[[".",64]],[[".",64]],[[".",3],["=",3],[".",15],["=",3],[".",10],["=",6],[".",4],["=",3],[".",17]],[[".",24],["=",3],[".",29],["=",3],[".",5]]],"entities":[{"uid":"enemy_mine_0","id":"cedar_sentinel","type":"enemy","region":"mine","position":[12928,608],"elite":false,"patrol":96},{"uid":"enemy_mine_1","id":"cedar_archer","type":"enemy","region":"mine","position":[13824,768],"elite":false,"patrol":96},{"uid":"crystal_mine_0","type":"crystal","region":"mine","position":[14112,1120]},{"uid":"altar_wall_jump","id":"wall_jump","type":"altar","region":"mine","position":[13088,1120]}],"landmarks":[{"region":"mine","piece":0,"position":[12544,992]}]}
