{"coord":[0,6],"rle":[[["#",24],["W",1],[".",7],["#",32]],[[".",24],["W",1],[".",39]],[[".",24],["W",1],[".",39]],[[".",4],["=",2],[".",6],["=",2],[".",6],["=",2],[".",2],["W",1],["=",2],[".",1],["=",4],[".",4],["=",2],[".",6],["=",2],[".",6],["=",2],[".",6],["=",2],[".",2]],[[".",24],["W",1],[".",39]],[[".",24],["W",1],[".",39]],[[".",24],["W",1],[".",39]],[["=",2],[".",1],["=",7],[".",1],["=",7],[".",1],["=",5],["W",1],["=",4],[".",1],["=",4],[".",1],["=",7],[".",1],["=",7],[".",1],["=",7],[".",1],["=",5]],[[".",64]],[[".",64]],[[".",12],["=",3],[".",37],["=",3],[".",9]],[["=",3],[".",21],["=",4],[".",5],["=",3],[".",22],["=",4],[".",2]],[[".",19],["=",4],[".",20],["=",4],[".",17]],[[".",64]],[[".",35],["=",5],[".",20],["=",4]],[[".",2],["=",6],[".",1],["=",4],[".",3],["=",3],[".",7],["=",4],[".",10],["=",3],[".",6],["=",4],[".",11]],[[".",64]],[[".",64]],[[".",26],["=",6],[".",32]],[[".",2],["=",3],[".",27],["=",3],[".",6],["=",4],[".",14],["=",4],[".",1]],[[".",9],["=",3],[".",7],["=",4],[".",30],["=",3],[".",8]],[[".",64]],[[".",4],["=",4],[".",48],["=",5],[".",3]],[[".",12],["=",7],[".",5],["=",4],[".",1],["=",3],[".",2],["=",6],[".",4],["=",3],[".",1],["=",3],[".",13]],[[".",24],["W",1],[".",39]],[[".",24],["W",1],[".",39]],[[".",5],["=",3],[".",8],["=",4],[".",4],["W",1],[".",39]],[[".",8],["=",3],[".",13],["W",1],["=",2],[".",1],["=",4],[".",2],["=",4],[".",4],["=",3],[".",19]],[[".",24],["W",1],[".",24],["=",3],[".",8],["=",4]],[[".",24],["W",1],[".",39]],[[".",24],["W",1],[".",11],["=",4],[".",4],["=",4],[".",16]],[["=",6],[".",7],["=",3],[".",3],["=",4],[".",1],["W",1],["=",4],[".",1],["=",2],[".",20],["=",9],[".",3]],[[".",24],["W",1],[".",39]],[[".",24],["W",1],[".",39]],[[".",19],["=",3],[".",2],["W",1],[".",19],["=",3],[".",17]],[[".",3],["=",4],[".",17],["W",1],["=",2],[".",1],["=",8],[".",12],["=",3],[".",6],["=",4],[".",3]]],"entities":[{"uid":"life_village_0","type":"life","region":"village","position":[1312,7136]}],"landmarks":[{"region":"village","piece":1,"position":[2016,6912]},{"region":"village","piece":2,"position":[992,7776]}]}
