{"coord":[0,9],"rle":[[[".",20],["=",4],["W",1],[".",39]],[[".",24],["W",1],[".",39]],[[".",24],["W",1],[".",11],["=",9],[".",19]],[[".",2],["=",4],[".",5],["=",4],[".",1],["=",5],[".",3],["W",1],["=",4],[".",1],["=",2],[".",16],["=",2],[".",1],["=",7],[".",1],["=",5]],[[".",24],["W",1],[".",39]],[[".",24],["W",1],[".",39]],[[".",24],["W",1],[".",36],["=",3]],[[".",8],["=",3],[".",6],["=",4],[".",3],["W",1],["=",2],[".",1],["=",4],[".",3],["=",4],[".",2],["=",3],[".",4],["=",3],[".",13]],[[".",1],["=",3],[".",20],["W",1],[".",39]],[[".",24],["W",1],[".",39]],[[".",24],["W",1],[".",7],["=",5],[".",6],["=",5],[".",16]],[[".",4],["=",4],[".",5],["=",3],[".",4],["=",3],[".",1],["W",1],["=",4],[".",1],["=",2],[".",18],["=",12],[".",2]],[[".",24],["W",1],[".",39]],[[".",24],["W",1],[".",39]],[[".",3],["=",3],[".",18],["W",1],[".",39]],[[".",19],["=",4],[".",1],["W",1],["=",2],[".",1],["=",4],[".",2],["=",3],[".",5],["=",4],[".",18]],[[".",11],["=",4],[".",9],["W",1],[".",24],["=",3],[".",8],["=",4]],[[".",24],["W",1],[".",39]],[[".",16],["=",5],[".",3],["W",1],[".",11],["=",4],[".",4],["=",4],[".",16]],[["=",4],[".",4],["=",3],[".",13],["W",1],["=",4],[".",1],["=",2],[".",20],["=",9],[".",3]],[[".",24],["W",1],[".",39]],[[".",24],["W",1],[".",39]],[[".",24],["W",1],[".",27],["=",3],[".",4],["=",3],[".",2]],[["=",3],[".",7],["=",3],[".",3],["=",4],[".",4],["W",1],["=",2],[".",1],["=",4],[".",9],["=",3],[".",20]],[[".",24],["W",1],[".",12],["=",3],[".",24]],[[".",24],["W",1],[".",39]],[[".",12],["=",4],[".",8],["W",1],[".",18],["=",5],[".",16]],[[".",2],["=",6],[".",10],["=",4],[".",2],["W",1],["=",4],[".",1],["=",5],[".",14],["=",4],[".",3],["=",4],[".",4]],[[".",64]],[[".",64]],[[".",48],["=",4],[".",9],["=",3]],[[".",1],["=",4],[".",21],["=",4],[".",5],["=",4],[".",1],["=",3],[".",21]],[[".",12],["=",4],[".",5],["=",3],[".",40]],[[".",64]],[[".",28],["=",9],[".",27]],[[".",4],["=",3],[".",1],["=",5],[".",3],["=",3],[".",26],["=",3],[".",3],["=",4],[".",1],["=",6],[".",2]]],"entities":[{"uid":"life_village_2","type":"life","region":"village","position":[1568,10464]},{"uid":"crystal_village_3","type":"crystal","region":"village","position":[1376,11104]}],"landmarks":[{"region":"village","piece":6,"position":[832,10848]}]}
