{"coord":[0,1],"rle":[[[".",40],["W",1],[".",23]],[[".",40],["W",1],[".",23]],[[".",40],["W",1],[".",23]],[[".",1],["=",4],[".",3],["=",2],[".",1],["=",7],[".",1],["=",7],[".",1],["=",7],[".",1],["=",5],["W",1],["=",4],[".",1],["=",4],[".",1],["=",7],[".",1],["=",5]],[[".",64]],[[".",64]],[[".",3],["=",3],[".",36],["=",6],[".",16]],[[".",17],["=",4],[".",13],["=",3],[".",14],["=",4],[".",1],["=",3],[".",5]],[[".",12],["=",4],[".",11],["=",4],[".",33]],[[".",64]],[[".",36],["=",4],[".",8],["=",5],[".",11]],[["=",4],[".",4],["=",5],[".",7],["=",3],[".",1],["=",3],[".",13],["=",4],[".",1],["=",3],[".",10],["=",6]],[[".",40],["W",1],[".",23]],[[".",40],["W",1],[".",23]],[[".",40],["W",1],[".",11],["=",3],[".",9]],[[".",1],["=",4],[".",3],["=",3],[".",5],["=",3],[".",6],["=",3],[".",7],["=",4],[".",1],["W",1],["=",2],[".",1],["=",4],[".",16]],[[".",40],["W",1],[".",18],["=",4],[".",1]],[[".",40],["W",1],[".",23]],[[".",27],["=",10],[".",3],["W",1],[".",23]],[[".",4],["=",3],[".",6],["=",3],[".",2],["=",6],[".",16],["W",1],["=",4],[".",1],["=",2],[".",1],["=",4],[".",3],["=",3],[".",5]],[[".",40],["W",1],[".",23]],[[".",40],["W",1],[".",23]],[[".",40],["W",1],[".",23]],[[".",1],["=",3],[".",14],["=",4],[".",4],["=",3],[".",3],["=",3],[".",5],["W",1],["=",2],[".",1],["=",7],[".",5],["=",4],[".",4]],[[".",9],["=",3],[".",28],["W",1],[".",23]],[[".",40],["W",1],[".",23]],[[".",3],["=",5],[".",12],["=",4],[".",4],["=",4],[".",8],["W",1],[".",23]],[[".",12],["=",4],[".",18],["=",6],["W",1],["=",4],[".",1],["=",2],[".",5],["=",3],[".",2],["=",4],[".",2]],[[".",40],["W",1],[".",23]],[[".",40],["W",1],[".",23]],[[".",28],["=",3],[".",4],["=",3],[".",2],["W",1],[".",23]],[[".",3],["=",4],[".",9],["=",4],[".",20],["W",1],["=",2],[".",1],["=",4],[".",9],["=",4],[".",3]],[[".",9],["=",3],[".",28],["W",1],[".",11],["=",4],[".",8]],[[".",40],["W",1],[".",23]],[["=",5],[".",35],["W",1],[".",23]],[[".",12],["=",4],[".",2],["=",4],[".",3],["=",4],[".",3],["=",4],[".",4],["W",1],["=",4],[".",1],["=",7],[".",7],["=",3],[".",1]]],"entities":[{"uid":"enemy_landing_2","id":"cedar_wisp","type":"enemy","region":"landing","position":[1056,1824],"elite":false,"patrol":96},{"uid":"life_landing_0","type":"life","region":"landing","position":[1248,1472]},{"uid":"life_landing_4","type":"life","region":"landing","position":[416,2272]},{"uid":"crystal_landing_0","type":"crystal","region":"landing","position":[1824,1248]},{"uid":"altar_dash","id":"dash","type":"altar","region":"landing","position":[800,1248]}],"landmarks":[{"region":"landing","piece":2,"position":[1120,2016]}]}
