{"coord":[1,5],"rle":[[[".",11],["=",4],[".",1],["W",1],[".",44],["=",3]],[[".",16],["W",1],[".",47]],[[".",16],["W",1],[".",11],["=",4],[".",3],["=",5],[".",24]],[[".",2],["=",9],[".",5],["W",1],["=",4],[".",1],["=",2],[".",18],["=",4],[".",3],["=",4],[".",3],["=",3],[".",5]],[[".",16],["W",1],[".",47]],[[".",16],["W",1],[".",47]],[[".",16],["W",1],[".",18],["=",3],[".",6],["=",3],[".",17]],[[".",8],["=",4],[".",4],["W",1],["=",2],[".",1],["=",4],[".",33],["=",3],[".",4]],[[".",5],["=",3],[".",8],["W",1],[".",8],["=",3],[".",23],["=",4],[".",9]],[[".",16],["W",1],[".",47]],[[".",16],["W",1],[".",42],["=",5]],[["=",3],[".",7],["=",4],[".",2],["W",1],["=",4],[".",1],["=",2],[".",4],["=",8],[".",5],["=",4],[".",3],["=",3],[".",13]],[[".",16],["W",1],[".",47]],[[".",16],["W",1],[".",47]],[[".",16],["W",1],[".",11],["=",3],[".",22],["=",7],[".",4]],[["=",3],[".",13],["W",1],["=",2],[".",1],["=",4],[".",8],["=",3],[".",29]],[[".",9],["=",3],[".",4],["W",1],[".",26],["=",4],[".",17]],[[".",16],["W",1],[".",47]],[[".",16],["W",1],[".",47]],[[".",2],["=",6],[".",4],["=",4],["W",1],["=",4],[".",1],["=",2],[".",1],["=",4],[".",8],["=",6],[".",5],["=",6],[".",5],["=",4],[".",1]],[[".",16],["W",1],[".",47]],[[".",16],["W",1],[".",47]],[[".",4],["=",3],[".",9],["W",1],[".",47]],[[".",8],["=",3],[".",5],["W",1],["=",2],[".",1],["=",4],[".",2],["=",4],[".",3],["=",4],[".",6],["=",4],[".",2],["=",3],[".",12]],[[".",16],["W",1],[".",42],["=",4],[".",1]],[[".",16],["W",1],[".",47]],[[".",16],["W",1],[".",11],["=",4],[".",8],["=",5],[".",6],["=",5],[".",8]],[[".",1],["=",4],[".",8],["=",3],["W",1],["=",4],[".",1],["=",2],[".",12],["=",3],[".",17],["=",3],[".",5]],[[".",64]],[[".",64]],[[".",18],["=",6],[".",3],["=",3],[".",22],["=",3],[".",6],["=",3]],[[".",2],["=",3],[".",3],["=",3],[".",29],["=",4],[".",20]],[[".",35],["=",4],[".",25]],[[".",64]],[[".",4],["=",4],[".",56]],[[".",10],["=",10],[".",1],["=",7],[".",4],["=",3],[".",7],["=",4],[".",3],["=",4],[".",3],["=",6],[".",2]]],"entities":[],"landmarks":[]}
