{"coord":[5,9],"rle":[[[".",21],["=",3],[".",16],["W",1],[".",18],["=",4],[".",1]],[[".",40],["W",1],[".",23]],[["=",5],[".",35],["W",1],[".",10],["=",5],[".",8]],[[".",8],["=",6],[".",2],["=",3],[".",6],["=",4],[".",5],["=",6],["W",1],["=",4],[".",1],["=",2],[".",8],["=",3],[".",5]],[[".",40],["W",1],[".",23]],[[".",40],["W",1],[".",23]],[[".",24],["=",4],[".",12],["W",1],[".",23]],[[".",8],["=",3],[".",6],["=",3],[".",14],["=",4],[".",2],["W",1],["=",2],[".",1],["=",4],[".",8],["=",4],[".",4]],[[".",1],["=",3],[".",36],["W",1],[".",10],["=",4],[".",9]],[[".",40],["W",1],[".",23]],[[".",19],["=",5],[".",12],["=",4],["W",1],[".",23]],[[".",4],["=",4],[".",5],["=",3],[".",11],["=",4],[".",9],["W",1],["=",4],[".",1],["=",5],[".",7],["=",4],[".",2]],[[".",64]],[[".",64]],[[".",29],["=",3],[".",20],["=",3],[".",9]],[[".",11],["=",4],[".",27],["=",3],[".",11],["=",3],[".",5]],[[".",5],["=",3],[".",12],["=",4],[".",11],["=",4],[".",25]],[[".",64]],[[".",8],["=",5],[".",31],["=",4],[".",16]],[["=",3],[".",13],["=",5],[".",3],["=",6],[".",2],["=",3],[".",14],["=",4],[".",8],["=",3]],[["#",56],[".",8]],[[".",64]],[[".",59],["=",3],[".",2]],[[".",4],["=",2],[".",6],["=",2],[".",6],["=",2],[".",6],["=",2],[".",6],["=",2],[".",6],["=",2],[".",6],["=",2],[".",10]],[[".",64]],[[".",64]],[[".",64]],[["=",2],[".",1],["=",7],[".",1],["=",7],[".",1],["=",7],[".",1],["=",7],[".",1],["=",7],[".",1],["=",7],[".",1],["=",9],[".",4]],[[".",64]],[[".",64]],[[".",4],["=",3],[".",57]],[[".",11],["=",4],[".",9],["=",3],[".",7],["=",4],[".",4],["=",3],[".",3],["=",3],[".",6],["=",3],[".",4]],[[".",21],["=",3],[".",40]],[[".",64]],[[".",8],["=",5],[".",23],["=",4],[".",4],["=",4],[".",11],["=",5]],[[".",1],["=",4],[".",11],["=",3],[".",7],["=",6],[".",21],["=",3],[".",8]]],"entities":[{"uid":"enemy_skywalk_7","id":"cedar_wisp","type":"enemy","region":"skywalk","position":[11392,10528],"elite":false,"patrol":96},{"uid":"enemy_skywalk_9","id":"cedar_sentinel","type":"enemy","region":"skywalk","position":[11040,11360],"elite":false,"patrol":96},{"uid":"life_skywalk_3","type":"life","region":"skywalk","position":[11776,11232]},{"uid":"lore_skywalk","type":"lore_item","region":"skywalk","position":[11904,10624],"requires":["vision"],"secret":true},{"uid":"boss_skywalk","id":"gugalanna","type":"boss","region":"skywalk","position":[11232,11488],"display_name":"하늘 잔도의 수호자","placeholder":true,"patrol":256}],"landmarks":[{"region":"skywalk","piece":7,"position":[11072,11360]}]}
