{"coord":[0,0],"rle":[[[".",64]],[[".",64]],[[".",32],["=",4],[".",9],["=",3],[".",16]],[["=",3],[".",14],["=",3],[".",7],["=",4],[".",17],["=",4],[".",12]],[[".",12],["=",4],[".",45],["=",3]],[[".",64]],[[".",19],["=",10],[".",35]],[[".",2],["=",11],[".",22],["=",4],[".",1],["=",6],[".",4],["=",4],[".",2],["=",3],[".",5]],[[".",40],["W",1],[".",23]],[[".",40],["W",1],[".",23]],[[".",21],["=",3],[".",16],["W",1],[".",11],["=",3],[".",1],["=",4],[".",4]],[["=",3],[".",7],["=",3],[".",21],["=",4],[".",2],["W",1],["=",2],[".",1],["=",4],[".",16]],[[".",25],["=",3],[".",12],["W",1],[".",23]],[[".",40],["W",1],[".",23]],[[".",12],["=",4],[".",20],["=",4],["W",1],[".",23]],[[".",5],["=",3],[".",8],["=",6],[".",6],["=",4],[".",8],["W",1],["=",4],[".",1],["=",2],[".",1],["=",4],[".",6],["=",4],[".",1]],[[".",40],["W",1],[".",23]],[[".",40],["W",1],[".",23]],[["=",4],[".",36],["W",1],[".",20],["=",3]],[[".",17],["=",4],[".",19],["W",1],["=",2],[".",1],["=",4],[".",3],["=",4],[".",9]],[[".",11],["=",4],[".",13],["=",4],[".",5],["=",3],["W",1],[".",23]],[[".",40],["W",1],[".",23]],[[".",40],["W",1],[".",7],["=",5],[".",11]],[[".",3],["=",4],[".",1],["=",3],[".",9],["=",3],[".",1],["=",5],[".",3],["=",3],[".",5],["W",1],["=",4],[".",1],["=",2],[".",8],["=",6],[".",2]],[[".",40],["W",1],[".",23]],[[".",40],["W",1],[".",23]],[[".",5],["=",3],[".",19],["=",3],[".",10],["W",1],[".",23]],[[".",18],["=",3],[".",14],["=",4],[".",1],["W",1],["=",2],[".",1],["=",4],[".",1],["=",4],[".",3],["=",3],[".",5]],[[".",13],["=",3],[".",24],["W",1],[".",23]],[[".",40],["W",1],[".",23]],[[".",20],["=",4],[".",8],["=",5],[".",3],["W",1],[".",23]],[["=",6],[".",2],["=",3],[".",13],["=",4],[".",12],["W",1],["=",4],[".",1],["=",2],[".",4],["=",3],[".",3],["=",6]],[[".",8],["#",32],["W",1],[".",7],["#",16]],[[".",40],["W",1],[".",23]],[[".",4],["=",3],[".",33],["W",1],[".",23]],[[".",12],["=",2],[".",6],["=",2],[".",6],["=",2],[".",6],["=",2],[".",2],["W",1],["=",2],[".",1],["=",4],[".",4],["=",2],[".",6],["=",2],[".",2]]],"entities":[{"uid":"enemy_landing_0","id":"cedar_sentinel","type":"enemy","region":"landing","position":[640,608],"elite":false,"patrol":96},{"uid":"enemy_landing_1","id":"cedar_archer","type":"enemy","region":"landing","position":[1504,736],"elite":false,"patrol":96}],"landmarks":[{"region":"landing","piece":0,"position":[288,992]}]}
