{"coord":[7,4],"rle":[[[".",32],["W",1],[".",31]],[[".",32],["W",1],[".",31]],[[".",32],["W",1],[".",10],["=",3],[".",18]],[["=",4],[".",6],["=",3],[".",13],["=",4],[".",2],["W",1],["=",2],[".",1],["=",4],[".",24]],[[".",20],["=",4],[".",8],["W",1],[".",16],["=",3],[".",7],["=",4],[".",1]],[[".",32],["W",1],[".",31]],[[".",12],["=",4],[".",12],["=",4],["W",1],[".",31]],[[".",2],["=",4],[".",10],["=",5],[".",11],["W",1],["=",4],[".",1],["=",6],[".",8],["=",7],[".",5]],[["#",32],["W",1],[".",7],["#",16],[".",8]],[[".",32],["W",1],[".",31]],[[".",32],["W",1],[".",31]],[[".",4],["=",2],[".",6],["=",2],[".",6],["=",2],[".",6],["=",2],[".",2],["W",1],["=",2],[".",1],["=",4],[".",4],["=",2],[".",6],["=",2],[".",3],["=",3],[".",4]],[[".",32],["W",1],[".",31]],[[".",32],["W",1],[".",31]],[[".",32],["W",1],[".",26],["=",5]],[["=",2],[".",1],["=",7],[".",1],["=",7],[".",1],["=",7],[".",1],["=",5],["W",1],["=",4],[".",1],["=",4],[".",1],["=",7],[".",1],["=",5],[".",8]],[[".",32],["W",1],[".",31]],[[".",32],["W",1],[".",31]],[[".",4],["=",3],[".",25],["W",1],[".",31]],[[".",10],["=",4],[".",3],["=",3],[".",5],["=",4],[".",3],["W",1],["=",2],[".",1],["=",4],[".",8],["=",3],[".",5],["=",4],[".",4]],[[".",32],["W",1],[".",8],["=",3],[".",20]],[[".",32],["W",1],[".",31]],[[".",12],["=",4],[".",3],["=",5],[".",8],["W",1],[".",31]],[[".",1],["=",4],[".",23],["=",3],[".",1],["W",1],["=",4],[".",1],["=",2],[".",4],["=",4],[".",5],["=",3],[".",2],["=",4],[".",2]],[[".",32],["W",1],[".",31]],[[".",32],["W",1],[".",31]],[[".",8],["=",4],[".",8],["=",3],[".",6],["=",3],["W",1],[".",31]],[[".",32],["W",1],["=",2],[".",1],["=",4],[".",1],["=",3],[".",13],["=",4],[".",3]],[[".",3],["=",4],[".",25],["W",1],[".",20],["=",3],[".",8]],[[".",32],["W",1],[".",31]],[[".",32],["W",1],[".",10],["=",5],[".",16]],[["=",3],[".",8],["=",4],[".",2],["=",4],[".",3],["=",6],[".",2],["W",1],["=",4],[".",1],["=",2],[".",8],["=",3],[".",9],["=",3],[".",1]],[[".",64]],[[".",64]],[[".",43],["=",3],[".",14],["=",3],[".",1]],[[".",1],["=",4],[".",13],["=",3],[".",6],["=",4],[".",1],["=",3],[".",14],["=",3],[".",12]]],"entities":[{"uid":"enemy_mine_7","id":"cedar_wisp","type":"enemy","region":"mine","position":[15488,4768],"elite":false,"patrol":96},{"uid":"enemy_mine_9","id":"cedar_sentinel","type":"enemy","region":"mine","position":[14976,5600],"elite":true,"patrol":96},{"uid":"life_mine_3","type":"life","region":"mine","position":[15840,5568]},{"uid":"lore_mine","type":"lore_item","region":"mine","position":[15968,4736],"requires":["vision"],"secret":true}],"landmarks":[{"region":"mine","piece":7,"position":[15200,5600]}]}
