{"coord":[7,9],"rle":[[[".",44],["=",4],[".",5],["=",3],[".",8]],[[".",64]],[[".",20],["=",9],[".",35]],[[".",2],["=",10],[".",24],["=",3],[".",1],["=",5],[".",3],["=",3],[".",5],["=",6],[".",2]],[[".",64]],[[".",64]],[[".",28],["=",3],[".",22],["=",3],[".",8]],[["=",4],[".",5],["=",4],[".",21],["=",4],[".",2],["=",3],[".",21]],[[".",19],["=",4],[".",34],["=",3],[".",4]],[[".",64]],[[".",36],["=",4],[".",24]],[[".",2],["=",4],[".",6],["=",3],[".",1],["=",3],[".",6],["=",4],[".",13],["=",12],[".",6],["=",4]],[[".",64]],[[".",64]],[[".",11],["=",3],[".",2],["=",4],[".",44]],[["=",3],[".",38],["=",3],[".",5],["=",4],[".",3],["=",3],[".",5]],[[".",25],["=",3],[".",8],["=",4],[".",24]],[[".",64]],[[".",43],["=",5],[".",16]],[[".",2],["=",10],[".",7],["=",4],[".",5],["=",9],[".",15],["=",3],[".",6],["=",3]],[[".",64]],[[".",64]],[[".",45],["=",3],[".",16]],[["=",3],[".",7],["=",3],[".",12],["=",4],[".",6],["=",4],[".",17],["=",4],[".",4]],[[".",21],["=",3],[".",28],["=",4],[".",8]],[[".",64]],[[".",12],["=",4],[".",16],["=",5],[".",27]],[[".",5],["=",3],[".",8],["=",3],[".",9],["=",3],[".",9],["=",6],[".",2],["=",5],[".",5],["=",4],[".",2]],[[".",64]],[[".",64]],[[".",52],["=",3],[".",6],["=",3]],[[".",35],["=",4],[".",1],["=",4],[".",20]],[[".",1],["=",3],[".",8],["=",4],[".",5],["=",3],[".",3],["=",4],[".",33]],[[".",64]],[[".",32],["=",5],[".",27]],[[".",4],["=",9],[".",3],["=",3],[".",5],["=",3],[".",15],["=",4],[".",3],["=",4],[".",3],["=",6],[".",2]]],"entities":[{"uid":"enemy_deep_7","id":"cedar_wisp","type":"enemy","region":"deep","position":[15488,10528],"elite":false,"patrol":96},{"uid":"enemy_deep_9","id":"cedar_sentinel","type":"enemy","region":"deep","position":[15040,11392],"elite":false,"patrol":96},{"uid":"life_deep_3","type":"life","region":"deep","position":[15904,11232]},{"uid":"lore_deep","type":"lore_item","region":"deep","position":[15936,10464],"requires":["vision"],"secret":true}],"landmarks":[{"region":"deep","piece":7,"position":[15232,11392]}]}
