{"coord":[4,6],"rle":[[[".",64]],[[".",64]],[[".",64]],[[".",3],["=",4],[".",1],["=",3],[".",6],["=",4],[".",3],["=",4],[".",4],["=",3],[".",8],["=",4],[".",2],["=",3],[".",12]],[[".",57],["=",3],[".",4]],[[".",64]],[["=",5],[".",35],["=",5],[".",6],["=",5],[".",8]],[[".",13],["=",3],[".",4],["=",3],[".",3],["=",4],[".",4],["=",6],[".",20],["=",4]],[[".",40],["W",1],[".",23]],[[".",40],["W",1],[".",23]],[[".",13],["=",7],[".",20],["W",1],[".",10],["=",3],[".",10]],[[".",1],["=",4],[".",29],["=",3],[".",3],["W",1],["=",2],[".",1],["=",4],[".",11],["=",4],[".",1]],[[".",28],["=",4],[".",8],["W",1],[".",23]],[[".",40],["W",1],[".",23]],[[".",36],["=",4],["W",1],[".",15],["=",5],[".",3]],[[".",4],["=",3],[".",1],["=",6],[".",5],["=",4],[".",1],["=",5],[".",11],["W",1],["=",4],[".",1],["=",6],[".",12]],[[".",40],["W",1],[".",23]],[[".",40],["W",1],[".",23]],[[".",40],["W",1],[".",12],["=",3],[".",4],["=",3],[".",1]],[["=",4],[".",21],["=",4],[".",3],["=",3],[".",5],["W",1],["=",2],[".",1],["=",4],[".",16]],[[".",13],["=",3],[".",3],["=",4],[".",17],["W",1],[".",23]],[[".",40],["W",1],[".",23]],[[".",40],["W",1],[".",23]],[[".",2],["=",4],[".",2],["=",3],[".",5],["=",3],[".",9],["=",3],[".",3],["=",6],["W",1],["=",4],[".",1],["=",8],[".",3],["=",4],[".",3]],[[".",8],["#",16],[".",8],["#",8],["W",1],[".",7],["#",16]],[[".",40],["W",1],[".",23]],[[".",40],["W",1],[".",23]],[[".",2],["=",3],[".",7],["=",2],[".",6],["=",2],[".",14],["=",2],[".",2],["W",1],["=",2],[".",1],["=",4],[".",4],["=",2],[".",6],["=",2],[".",2]],[[".",27],["=",4],[".",9],["W",1],[".",23]],[[".",40],["W",1],[".",23]],[[".",4],["=",4],[".",32],["W",1],[".",23]],[[".",8],["=",2],[".",1],["=",7],[".",1],["=",8],[".",5],["=",2],[".",1],["=",5],["W",1],["=",4],[".",1],["=",4],[".",1],["=",7],[".",1],["=",5]],[[".",64]],[[".",64]],[[".",42],["=",6],[".",3],["=",3],[".",2],["=",4],[".",4]],[[".",26],["=",3],[".",35]]],"entities":[{"uid":"enemy_skywalk_2","id":"cedar_wisp","type":"enemy","region":"skywalk","position":[9152,7584],"elite":false,"patrol":96},{"uid":"life_skywalk_0","type":"life","region":"skywalk","position":[9440,7136]}],"landmarks":[{"region":"skywalk","piece":2,"position":[9152,7808]}]}
