{"coord":[6,3],"rle":[[[".",32],["W",1],[".",31]],[[".",32],["W",1],[".",31]],[[".",20],["=",4],[".",8],["W",1],[".",15],["=",5],[".",11]],[[".",4],["=",3],[".",6],["=",3],[".",8],["=",4],[".",4],["W",1],["=",4],[".",1],["=",2],[".",2],["=",4],[".",11],["=",4],[".",3]],[[".",32],["W",1],[".",31]],[[".",32],["W",1],[".",31]],[[".",5],["=",3],[".",24],["W",1],[".",26],["=",3],[".",2]],[[".",32],["W",1],["=",2],[".",1],["=",7],[".",6],["=",4],[".",11]],[[".",9],["=",3],[".",7],["=",4],[".",5],["=",4],["W",1],[".",31]],[[".",32],["W",1],[".",31]],[[".",32],["W",1],[".",31]],[["=",6],[".",6],["=",7],[".",5],["=",5],[".",3],["W",1],["=",4],[".",1],["=",2],[".",2],["=",6],[".",4],["=",3],[".",1],["=",4],[".",4]],[[".",64]],[[".",64]],[[".",12],["=",3],[".",19],["=",6],[".",24]],[[".",17],["=",3],[".",7],["=",4],[".",18],["=",4],[".",3],["=",4],[".",4]],[[".",5],["=",3],[".",35],["=",4],[".",17]],[[".",64]],[[".",19],["=",10],[".",35]],[["=",3],[".",6],["=",4],[".",19],["=",4],[".",1],["=",6],[".",9],["=",3],[".",3],["=",4],[".",2]],[[".",32],["W",1],[".",31]],[[".",32],["W",1],[".",31]],[[".",3],["=",3],[".",26],["W",1],[".",19],["=",3],[".",9]],[[".",8],["=",3],[".",6],["=",4],[".",11],["W",1],["=",2],[".",1],["=",8],[".",20]],[[".",27],["=",4],[".",1],["W",1],[".",27],["=",4]],[[".",32],["W",1],[".",31]],[[".",32],["W",1],[".",31]],[["=",4],[".",6],["=",6],[".",4],["=",3],[".",1],["=",3],[".",5],["W",1],["=",4],[".",1],["=",2],[".",2],["=",4],[".",3],["=",4],[".",3],["=",5],[".",3]],[[".",32],["W",1],[".",31]],[[".",32],["W",1],[".",31]],[[".",32],["W",1],[".",15],["=",4],[".",7],["=",3],[".",2]],[[".",1],["=",3],[".",7],["=",4],[".",1],["=",3],[".",5],["=",4],[".",4],["W",1],["=",2],[".",1],["=",4],[".",1],["=",4],[".",19]],[[".",32],["W",1],[".",31]],[[".",32],["W",1],[".",31]],[[".",3],["=",10],[".",19],["W",1],[".",31]],[[".",21],["=",3],[".",2],["=",4],[".",2],["W",1],["=",4],[".",1],["=",2],[".",4],["=",3],[".",4],["=",4],[".",1],["=",4],[".",4]]],"entities":[{"uid":"enemy_mine_5","id":"cedar_sentinel","type":"enemy","region":"mine","position":[12864,3808],"elite":false,"patrol":96},{"uid":"enemy_mine_6","id":"cedar_archer","type":"enemy","region":"mine","position":[14176,3936],"elite":false,"patrol":96}],"landmarks":[{"region":"mine","piece":4,"position":[12480,3552]},{"region":"mine","piece":5,"position":[14304,4224]}]}
